"recno","Observer","Location","Desg","Month","Day","Year","m1","diam","dc","pa","scope","comments","jd","url"
"1683","P. Clay Sherrod","ASO - Petit Jean H41","C/2001 HT50 (LINEAR-NEAT)","1","15.07","2004","13.8","25""","4/9","69","0.41m SCT/ccd....","Very nice straight tail in PA 68 degrees, with secondary ""hump"" extension nearly due south of coma, possible tail feature; diffuse and large even though low in SE sky","2453019.5700",""
"1685","P. Clay Sherrod","ASO - Petit Jean H41","P/2004 A1","1","20.26","2004","17.9","8""","6/9","none","0.41m SCT/ccd....","Newly designated comet from asteroidal class object; indeed showing very slight diffusity to coma, not stellar but very small and faint; moving slowly southeast","2453024.7600",""
"1689","P. Clay Sherrod","ASO - Petit Jean H41","C/2003 T2 (LINEAR)","1","22.08","2004","17.4","9""","6/9","none","0.41m SCT/ccd....","Very small, noticeably diffuse but very faint","2453026.5800",""
"1690","P. Clay Sherrod","ASO - Petit Jean H41","P/2004 A1","1","22.34","2004","18.0","<8""","8/9","none","0.41m SCT/ccd....","Very small, with only a suggestion of nebulosity","2453026.8400",""
"1691","P. Clay Sherrod","ASO - Petit Jean H41","P/2004 A1","1","23.27","2004","18.0","8""","8/9","none","0.41m SCT/ccd....","Object is pretty much stellar in nature, and any nebulosity would be suspect; very small","2453027.7700",""
"1692","P. Clay Sherrod","ASO - Petit Jean H41","C/2003 V1 (LINEAR)","1","23.41","2004","16.8","12""","3/9","irreg.","0.41m SCT/ccd....","A very diffuse, open and irregular coma, no tail nor central conds.","2453027.9100",""
"1693","P. Clay Sherrod","ASO - Petit Jean H41","C/2003 T2 (LINEAR)","1","26.09","2004","17.6","8""","5/9","none","0.41m SCT/ccd....","Very faint and small, nearly starlike but suggestion of nebulosity compared to ccd star field","2453030.5900",""
"1699","P. Clay Sherrod","ASO - Petit Jean H41","40P Vaisala","2","16.4","2004","15.9 (m2)","n/a","4/9","n/a","0.41m SCT/ccd....","Very vague, difficult with only a slight concentration for astrometric centroid","2453051.9000",""
"1700","P. Clay Sherrod","ASO - Petit Jean H41","P/2003 WC7 (LINEAR-Catalina)","2","22.07","2004","17.6","10""","4/9","none","0.41m SCT/ccd....","Slightly diffuse, difficult object","2453057.5700",""
"1703","P. Clay Sherrod","ASO - Petit Jean H41","40P Vaisala","3","7.34","2004","15.2 (m2)","14""","4/9","n/a","0.41m SCT/ccd....","Total magnitude est. not possible due to low altitude of comet and very strong full moonlight; imaged astrometrically","2453071.8400",""
"1707","P. Clay Sherrod","ASO - Petit Jean H41","40P Vaisala","4","1.41","2004","14.7 (*)","25""","6/9","wide fan, we","0.41m SCT/ccd....","A very fine and broad fanned tail west of the coma; spanning 252-310 deg. PA; coma, not round but conforming to shape of tail,  is sharply differentiated in brightness, with the inner half markedly brighter (*m2=16.9ccd)","2453096.9100",""
"1708","P. Clay Sherrod","ASO - Petit Jean H41","40P Vaisala","4","1.42","2004","14.7","","","","0.41m SCT/ccd....","See previous data for physical information of comet; note the very irregular nature of the tail, possible segmented to the west. Negative image","2453096.9200","40p_0401.jpg"
"1709","P. Clay Sherrod","ASO - Petit Jean H41","P/2004 CB (LINEAR)","4","4.45","2004","15.5","13""","5/9","~275","0.41m SCT/ccd....","Very concentrated coma, no indication of nucleus; uniformly bright with possible tail in PA 275 deg; moving rapidly east","2453099.9500",""
"1711","P. Clay Sherrod","ASO - Petit Jean H41","40P Vaisala","4","8.39","2004","16.7 (m2)","~11"" moon","4/9","west","0.41m SCT/ccd....","Faint indication of tail in PA 270, but very strong moonlight and high fog; m1 and physical characteristics not possible under conditions","2453103.8900",""
"1712","P. Clay Sherrod","ASO - Petit Jean H41","C/2003 K4 (LINEAR)","4","8.41","2004","11.4 (*)","26""","5/9","none","0.41m SCT/ccd....","Very round, pronounced in rich star field; comet is all coma, with no indication of tail; easy target in spite of strong moonlight; *m2=14.6ccd","2453103.9100",""
"1713","P. Clay Sherrod","ASO - Petit Jean H41","117P Helin-Roman-Alu","4","14.28","2004","16.9","8""","5/9","n/a","0.41m SCT/ccd....","Very small and not stellar; no distinct nucleus nor tail; fairly difficult object","2453109.7800",""
"1715","P. Clay Sherrod","ASO - Petit Jean H41","40P Vaisala","4","14.30","2004","15.1","19""","4/9","west","0.41m SCT/ccd....","A very faint tail nearly due west of a quite diffuse and open coma; very little central condensation","2453109.8000",""
"1717","P. Clay Sherrod","ASO - Petit Jean H41","81P Wild 2","4","27.41","2004","16.3","10""","3/9","n/a","0.41m SCT/ccd....","Very open and diffuse with no tail visible; in appulse with similar mag. star","2453122.9100",""
"1719","P. Clay Sherrod","ASO - Petit Jean H41","C/2001 K5 (LINEAR)","4","28.41","2004","16.3","8""","7/9","~180","0.41m SCT/ccd....","The very pronounced tail that has been present with this comet is not seen after many months of observations; comet is very small, condensed with possibly a short extension in PA 180 deg.","2453123.9100",""
"1720","P. Clay Sherrod","ASO - Petit Jean H41","C/2003 K4 (LINEAR)","4","28.42","2004","11.5 (*)","42""","4/9","233","0.41m SCT/ccd....","Short ""tadpole tail"" in PA 233, rapidly tapering; comet has very large and concentrated coma with faint (*m2-14.5ccd) nucleus; slightly brighter in beautiful star field","2453123.9200",""
"1721","P. Clay Sherrod","ASO - Petit Jean H41","C/2001 Q4 (NEAT)","5","6.07","2004","PHOTO","","","","0.41m SCT/ccd....","Showing extraordinary detail in the very center of the comet, as imaged with the f/3.3 0.41m SCT at ASO.","2453131.5700","q4_May6.jpg"
"1723","P. Clay Sherrod","","P/2004 HC18 (LINEAR)","5","16","2004","17.4","8""","6/9","none","0.41m SCT/ccd....10x50B","","2453141.5000",""
"1724","P. Clay Sherrod","","40P Vaisala","5","16.32","2004","14.7","22""","4/9","295","0.41m SCT/ccd....10x50B","Very faint tail noted via ccd in PA 295; comet is open and diffuse with little central conds., coma appears slightly irregular","2453141.8200",""
"1725","P. Clay Sherrod","","P/2004 HC18 (LINEAR)","5","19.16","2004","17.8 (m2)","7""","6/9","n/a","0.41m SCT/ccd....10x50B","Appears quite concentrated and stellar; no coma nor tail","2453144.6600",""
"1726","P. Clay Sherrod","","81P Wild 2","6","12.36","2004","16.3 (*)","12""","5/9","none","0.41m SCT/ccd....10x50B","Comet is diffuse and fairly easy target, albeit low in SE; no tail and very slight central conds (*m2=17.4ccd)","2453168.8600",""
"1728","P. Clay Sherrod","ASO Petit Jean Mountain","88P - Howell","8","26.36","2004","16.5","11""","7/9","none","0.41m SCT/ccd....10x50B","Small, round and slightly concentrated; no tail","2453243.8600",""
"1736","P. Clay Sherrod","ASO Petit Jean Mountain","C/2004 U1 (LINEAR)","12","12.30","2004","15.2 (*)","22""","7/9","none","0.41m SCT/ccd...","Very nice, highly condensed comet, with compressed coma (*m2=16.2ccd)and very little outer nebulosity noted (d=22""); comet is moving relatively rapid to the NW; extended ccd shows no indication of tail","2453351.8000",""
"1737","P. Clay Sherrod","ASO Petit Jean Mountain","C/2003 T3 (Tabur)","12","12.42","2004","16.1","10""","6/9","none","0.41m SCT/ccd...","Coma differentiated in inner and outer with strong condensation (*m2=17.3ccd); no tail","2453351.9200",""
"1738","P. Clay Sherrod","ASO Petit Jean Mountain","C/2004 U1 (LINEAR)","12","17.38","2004","14.6 (*)","15""","5/9","possible 227","0.41m SCT/ccd...","A very interesting fast-moving comet; very compact and uniformly bright across round coma; possible very short tail (stubby, via CCD) in PA 227. Brightness and uniformity resemble planetary neb. of same magnitude","2453356.8800",""
"1739","P. Clay Sherrod","ASO Petit Jean Mountain","C/2004 U1 (LINEAR)","12","20.37","2004","14.4 (*)","21""","6/9","none","0.41m SCT/ccd...","This circumpolar comet is nearly perfectly spheroid shaped with a very concentrated coma and no tail; moving rapidly still to the NE. (*m2=15.6ccd)","2453359.8700",""
"1740","P. Clay Sherrod","ASO Petit Jean Mountain","C/2004 RG113 (LINEAR)","12","20.39","2004","17.1 (*)","11""","3/9","irreg.","0.41m SCT/ccd...","Very diffuse and irregular appearing around coma perimeter; some central conds. (*m2=18.0ccd)","2453359.8900",""
"1741","P. Clay Sherrod","ASO Petit Jean Mountain","C/2003 T3 (Tabur)","12","20.40","2004","16.7 (*)","13""x8""","2/9","elongated","0.41m SCT/ccd...","Comet coma is elongated and irregular in SE-NW direction; very diffuse and open with very little central conds. (*m2=17.0ccd)","2453359.9000",""
"1742","P. Clay Sherrod","ASO Petit Jean Mountain","C/2004 U1 (LINEAR)","12","21.33","2004","14.7 (*)","17""","7/9","216","0.41m SCT/ccd...","A very faint but distinct tail in PA 216 deg. stretches about 36"" from highly concentrated coma; comet is more condensed than previous and continues rapid motion to the NE (*m2=15.8ccd)","2453360.8300",""
"1744","P. Clay Sherrod","ASO Petit Jean Mountain","C/2004 RG113 (LINEAR)","1","24.31","2005","16.9 (*)","9""","7/9","none","0.41m SCT/ccd...","Very condensed (*m2=17.3ccd) and appearing nearly stellar in bright full moonlight nearby","2453394.8100",""
"1747","P. Clay Sherrod","ASO Petit Jean Mountain","C/2004 K1 (Catalina)","5","5.36","2005","15.4 (*)","~11""","7/9","slight 160","0.41m SCT/ccd...","A very slight elongation in PA 160 degree, more of an extension of the coma than a tail; very compact, but clearly diffuse (*m2=16.8ccd); moving quite rapidly","2453495.8600",""
"1749","P. Clay Sherrod","ASO Petit Jean Mountain","P/2005 JQ5 (Catalina)","5","18.33","2005","16.5 (*)","9""","8/9","none","0.41m SCT/ccd...","Moving rapidly, and only very slightly diffuse; could easily be mistaken for asteroid; no tail and only slight coma (9"")","2453508.8300",""
"1750","P. Clay Sherrod","ASO Petit Jean Mountain","C/2005 B1 (Christensen)","5","18.35","2005","16.8 (*)","8""","7/9","round","0.41m SCT/ccd...","Quite round, compact and nearly stellar; very little nebulosity seen (*m2=17.4ccd); no tail","2453508.8500",""
"1754","P. Clay Sherrod","ASO Petit Jean Mountain","C/2004 K1 (Catalina)","5","20.29","2005","14,8 (*)","15""","6/9","126","0.41m SCT/ccd...","Broad but short tail in PA ~126deg; difficult in strong gibbous moonlight; somewhat distinct nuclear center (*m2=16.2ccd)","2453510.7900",""
"1757","P. Clay Sherrod","ASO Petit Jean Mountain South - H45","C/2005 K1 (Skiff)","5","26.38","2005","16.8 (*)","~9""","7/9","none","0.41m SCT @ f/3.3 ccd","Comet is uniformly round with a slight central Conds. (*m2=17.9ccd); no tail, very small and compact","2453516.8800",""
"1758","P. Clay Sherrod","ASO Petit Jean Mountain South - H45","C/2004 K1 (Catalina)","5","26.37","2005","15.8 (*)","10"" moonligh","7/9","n/a","0.41m SCT @ f/3.3 ccd","Very strong moonlight and high intermittent clouds; comet appears small (10"") with no tail; fairly strong central conds. (*m2=16.1ccd)","2453516.8700",""
"1763","P. Clay Sherrod","ASO Petit Jean Mountain","C/2005 K1 (Skiff)","6","3.36","2005","15.9","9""","7/9","none","0.41m SCT/ccd...","Very compact and small; little indication of central condensation, although CCD readings indicate m2=16.8; no tail and only slightly diffuse","2453524.8600",""
"1764","P. Clay Sherrod","ASO Petit Jean Mountain","P/2005 JY126 (Catalina)","6","8.26","2005","17.7 (*)","7""","5/9","none","0.41m SCT/ccd...","A very difficult object due to a very low surface brightness and nebulosity...appears without any distinct central core (*m2-18.3ccd) and round, very diffuse","2453529.7600",""
"1766","P. Clay Sherrod","ASO Petit Jean Mountain","P/2005 L1 (McNaught)","6","8.31","2005","*17.4","6-7""","7/9","none","0.41m SCT/ccd...","Nearly stellar, quite small without nebulosity nor tail; appears that nuclear and total mag. are pretty much the same on this one","2453529.8100",""
"1773","P. Clay Sherrod","","C/2005 A1 (LINEAR)","8","2","2005","","","","","0.41m RC/ccd...","","2453584.5000","ComA81FF67.jpg"
"1776","P. Clay Sherrod","ASO Petit Jean Mtn.- H45","29P Schwassmann-Wachmann","9","30.37","2005","16.1(*)","11""","7/9","210?","0.41m RC/ccd...","A very conspicuous segment or streamer (knot?)in PA 210 deg., about 15"" from central condensation (*m2=16.9); comet is unusually compact with very little dispersion of coma except for extension and knot at PA 210","2453643.8700",""
"1780","P. Clay Sherrod, ASO Peti","","C/2003 K4 (LINEAR)","01","25.1","2006","16.1 (*)","15""","3/0","254","0.41m RC @ f/3.3 CCD","Comet appears slightly elongated E-W; possible tail in PA 254 deg. for 8"" length; ""m2=17.4ccd","2453760.6000",""
"1785","P. Clay Sherrod","","73P/Schwassmann-Wachmann-C","04","03","2006","12.3","72""","5/9","239","0.41m RC @ f/3.3","Very bright, round, with diffuse and nearly transparent tail","2453828.5000",""
"1786","P. Clay Sherrod","","73P/Schwassmann-Wachmann-C","03","24","2006","12.2","64","5/9","245","0.41m RC @ f/3.3","","2453818.5000",""
"1788","P. Clay Sherrod","","73P/Schwassmann-Wachmann-B","04","03","2006","14.3*","58""","7/9","236","0.41m RC @ f/3.3 CCD","Very uniform and circularly bright; *m2=16.0ccd","2453828.5000",""
"1794","P. Clay Sherrod","","C/2006 CK10 (Catalina)","04","03","2006","17.5 *","8""","5/9","n/a","0.41m RC @ f/3.3 CCD","Round, diffuse; *m2=18.0ccd","2453828.5000",""
"1795","P. Clay Sherrod","","73P/Schwassmann-Wachmann-B","04","08","2006","9.7","2.1","4/0","220 & 244","0.41m RC @ f/3.3, CCD","","2453833.5000","http://www.arksky.org/smf/index.php?action=dl"
"1801","P. Clay Sherrod","","73P/Schwassmann-Wachmann-B","04","07","2006","9.7","1.5'","5/9","198 to 251","0.41m RC @ f/3.3, CCD","Nice fanning tail, but tenuous and faint","2453832.5000",""
"1802","P. Clay Sherrod","","73P/Schwassmann-Wachmann-R","04","07","2006","16.4 (*)","12""","4/9","230","0.41m RC @ f/3.3, CCD","*m2=17.9; comet appears to be fragmented or strongly elongated in PA 230","2453832.5000",""
"1803","P. Clay Sherrod","","73P/Schwassmann-Wachmann-G","04","07","2006","12.7 (*)","33""","7/9","237","0.41m RC @ f/3.3, CCD","Comet has dramatically brightened (*m2=14.9ccd); nice tail developing","2453832.5000",""
"1807","P. Clay Sherrod","","73P/Schwassmann-Wachmann-G","04","09","2006","10.3 (*)","30""","6/9","226","0.41m RC @ f/3.3 CCD","Note the increasingly fanned tail and concentration of coma; *m2=11.3ccd","2453834.5000","ComBCD04C3.jpg"
"1808","P. Clay Sherrod","","73P/Schwassmann-Wachmann-C","04","13","2006","9.2","1.4'","5/9","232","0.41m RC @ f/3.3 ccd","Very well developed round coma (*m2=10.2ccd) with fine ion tail; jet in PA 254 deg","2453838.5000","ComBD13A83.jpg"
"1809","P. Clay Sherrod","","73P/Schwassmann-Wachmann-B","04","13","2006","9.9 (*)","1.5 x 0.8' e","7/9","228","0.41m RC @ f/3.3 ccd","A very active nuclear core (*m2=14.3ccd), becoming very elongated in PA 228 (same direction as tail); see image","2453838.5000","ComBD125F0.jpg"
"1817","P. Clay Sherrod","","73P/Schwassmann-Wachmann-B","04","17","2006","10.0 (*)","1.8 x 1.0'","7/9","222","0.41m RC @ f/3.3, KAF 0402 Kodak CCD chip","Beautifully defined nucleus (*m2=14.5ccd), with strong ion tail showing excellent symmetry; coma is highly elongated.","2453842.5000","ComBD65065.jpg"
"1819","P. Clay Sherrod","","73P/Schwassmann-Wachmann-B","04","19","2006","10.0","1.1' x 0.4'","7/9","220","0.41m RC @ f/3.3, Kodak KAF0402ME ccd","Note that overall size of coma seems quite diminished tonight, and comet's overall m1 brightness has maintained; highly concentrated nucleus and definite signs of fragmentation (see high res. inset)","2453844.5000","ComBD8F645.jpg"
"1820","P. Clay Sherrod","","73P/Schwassmann-Wachmann-C","04","19","2006","8.0 (*)","2.0 elong","5/9","226","0.41m RC @ f/3.3, Kodak KAF0402ME ccd","Coma appears strongly arched (see inset isophote image); very strong concentration in coma, but clearly differentiated","2453844.5000","ComBD8F97F.jpg"
"1822","P. Clay Sherrod","","73P/Schwassmann-Wachmann-G","04","19","2006","11.3","41""","5/9","218","0.41m RC @ f/3.3, Kodak KAF0402ME ccd","Coma is elongating rapidly, similar to ""B"" component, suggesting likely fragmentation; tail is developing equally to this morphological change","2453844.5000","ComBD8FB1C.jpg"
"1826","P. Clay Sherrod","","73P/Schwassmann-Wachmann-AQ","04","24","2006","15.6 (*)","n/a","8/9","220","0.41m RC @ f/3.3, SBIG/ST402 CCD","NEW designation for component of ""B""; this being the component opposite the sunward side of the nucleus (""B""); fragment is stellar in appearance with thin cloud of nebulosity; see 73P-B for additional info","2453849.5000","ComBDFA7EB.jpg"
"1827","P. Clay Sherrod","","73P/Schwassmann-Wachmann-R","04","24","2006","17.4","~8""","3/9","212","0.41m RC @ f/3.3, SBIG/ST402 CCD","Very faint and curving tail with diffuse and arched coma; this fragment appears to be weakening or dissentigrating altogether","2453849.5000",""
"1833","P. Clay Sherrod","","73P/Schwassmann-Wachmann-C","04","28","2006","7.7","1.5 x2.2'","5/9","221","0.41m RC @ f/3.3/SBIG ST402ME ccd","Tail in PA 221, with strong central condensation embedded in very dense coma; some reports indicate (M. Holloway) fragmentation of nucleus on April 27","2453853.5000","ComBE4CC93.jpg"
"1836","P. Clay Sherrod","","73P/Schwassmann-Wachmann-R","04","28","2006","14.2","17""","4/9","212","0.41m RC @ f/3.3/SBIG ST402ME ccd","Nicely developing, appearing singular in terms of nuclei; very strong coma with embedded nucleus (m2=16.6ccd); very short and wide tail for limited anti-sun span","2453853.5000","ComBE4D00F.jpg"
"1837","P. Clay Sherrod","","73P/Schwassmann-Wachmann-B","05","09","2006","6.9","3.5' x 3.1'","8/9","233","0.41m RC @ f/3.3, ST-402 MEccd","An incredible sight, with a multi-front (sunward side) ""bow shock"" wave(s); nucleus is most definitely singular in high resolution imaging (m2=9.9ccd); very sharp and narrow spike in PA 233","2453864.5000","ComBF30E15.jpg"
"1839","P. Clay Sherrod","","cP/2006 M3 (Barnard 177P)","07","19","2006","13.4","43""","6/9","60","0.4m RC @ f/5, 60-sec, SBIG ST402ME, Class I","Very faint sunward spike suspected toward south (upper right of nucleus); strong nucleus with some elongation (m2=15.6ccd)","2453935.5000","ComC51630C.jpg"
"1840","P. Clay Sherrod","","29P Schwassmann-Wachmann","04","12","2010","16.5*","305""","8/9","0","0.5m Astrograph, f/4.7, CCD bin 2 x 2","","2455298.5000",""
"1842","P. Clay Sherrod","","c2010 G1 (Boattini)","04","12","2010","15.7  (16.1m","12""","6/9","0","0.5m Astrograph, f/4.7, CCD bin 2 x 2","Quite nice, round and with a condensed core, about 1/2 area, no tail","2455298.5000",""
"1846","P. Clay Sherrod","","c2006 OF2 (Broughton)","04","12","2010","19.1 (m1)","10""","0","0","0.5m Dall Kirkham astrography, f/4.7, CCD, binned 2 x 2","Comet is very uniformly diffuse with no clear central condensation; somewhat elongated and irregular around perimeter","2455298.5000",""
"1848","P. Clay Sherrod","","c2008 E1 (Catalina)","04","11","2010","19.2","<5.0""","9/9","0","0.5m Dall Kirkham astrography, f/4.7, CCD, binned 2 x 2","Comet is entirely starlike, very faint without nebulosity","2455297.5000",""
"1849","P. Clay Sherrod","","c2009 U5 (Grauer)","04","11","2010","19.7","6""","7/9","0","0.5m Dall Kirkham Astrograph, f/4.7, CCD, binned 2 x 2","Very difficult due to small size and faintness; not starlike but slightly diffuse","2455297.5000",""
"1851","P. Clay Sherrod","","c2010 F1 (Boattini)","04","12","2010","18.8 (19.2 m","6""","3/9","0","0.5m Dall Kirkham astrograph, f/4.7, CCD, binned 2 x 2","Comet is very difficult, diffuse and small with no central condensation","2455298.5000",""
"1853","P. Clay Sherrod","","81P Wild 2","04","10","2010","~9, 11.9m2","244""","6/9","300","0.5m Dall Kirkham, f/4.7 w/CCD, 2 x 2 binning","Split tail in PA 300 deg., about 9' in length with CCD; head is ""boomerang shape"", or like buffalo horns and very interesting with stellar nucleus attached to curving appendages.  Comet has green hue in color CCD capture","2455296.5000",""
"1855","P. Clay Sherrod","","c2010 G2 (Hill)","04","13","2010","19.3m2","5""","5/9","none","0.5m f/4.7 Dall Kirkham astrograph, CCD, 2 x 2 binned","To date, this is the most recent comet discovery; a nice small nebulous comet, with no tail and a slight hint of central condensation; very close to ephemeris position","2455299.5000",""
"1856","P. Clay Sherrod","","p2010 A5 (LINEAR)","04","13","2010","16.2","12""","7/9","299","0.5m f/4.7 Dall Kirkham astrograph, CCD with 2 x 2 binning","This is the lowest altitude (S) comet accessible from ASO; far in the south, showing a very nice narrow tail (19"") and condensed coma with nucleus (m2=16.5)","2455299.5000",""
"1857","P. Clay Sherrod","","c2008 FK75 (Lemmon-Siding Spring)","04","13","2010","16.1*","11""","8/9","201","0.5m f/4.7 Dall Kirkham, CCD with 2 x 2 binning","Very nice distinct comet with very delicate tail in PA 201, about 13"" long and curving; nucleus (*m2=16.6) is very pronounced","2455299.5000",""
"1864","P. Clay Sherrod","","81P Wild 2","04","15","2010","11.3*","282""","7/9","291","0.5m f/4.7 Dall Kirkham astrography, CCD @ 2x2 binning","Comet has brightened and a possible jet at PA 252 deg; split tail and boomerang appearance continues, with tail in PA 291 for a minimum of .9 deg.","2455301.5000","Com135A52ED.jpg"
"1865","P. Clay Sherrod","","c2010 F1 (Boattini)","04","15","2010","18.9*","6""","7/9","11","0.5m f/4.7 Dall Kirkham astrograph, CCD @ 2x2 binning","Possible wide extension (~5"") in PA 11 deg; comet is nearly stellar *=m2","2455301.5000",""
"1867","P. Clay Sherrod","","c2010 G2 (Hill)","04","15","2010","19.4","stellar","9/9","0","0.5m f/4.7 Dall Kirkham astrograph, CCD binned 2 x 2","Very difficult, slow moving and virtually stellar in appearance","2455301.5000",""
"1868","P. Clay Sherrod","","c2007 Q3 (Siding Spring)","04","15","2010","12.3 (*)","38""","7/9","234","0.5m f/4.7 Dall Kirkham astrograph, CCD binned 2 x 2","A very fine comet exhibiting a classic tail, becoming more fanned as time progresses; the tail is 513"" length in PA 234d, and very strong near coma; *m2=14.5; small fragment just outside of nucleus inside tail","2455301.5000",""
"1870","P. Clay Sherrod","","81P Wild 2","04","16","2010","~9","282""","7/9","291","0.5m f/4.7 astrograph (inset); 130mm APO f/5 main image, CCD","Composite image of both inner coma details and wide field (~2 deg.) of comet 81P Wild","2455302.5000","Com135AE723.jpg"
"1872","P. Clay Sherrod","","81P Wild 2","04","20","2010","8.6*","77/211","5/9","289d","0.5m f/4.7 Dall Kirkham astrograph, CCD, 2 x 2 binned","An fine sight; tail is split and horseshoe shaped from arcing coma; coma is differentiated into TWO sections, an elongated inner coma (77"" across) enveloped by a very thin and curving outer coma (211"" across); *m2=12.5","2455306.5000",""
"1874","P. Clay Sherrod","","29P Schwassmann-Wachmann","04","21","2010","12.9(*)","47""","7/9","round","0.5m f/4.7 Dall Kirkham astrograph, CCD @ 2x2 binning","Comet has brightened significantly (12.9 total, *m2=14.2) and nucleus is clearly more diffuse than on previous dates; difficult diameter determinations due to strong moonlight nearby","2455307.5000",""
"1875","P. Clay Sherrod","","c2010 F1 (Boattini)","04","21","2010","19.2*","6""","4/9","~80","0.5m f/4.7 Dall Kirkham astrograph, CCD @ 2x2 binning","Comet appears to have thin tail in PA 80 deg., some 8"" length, but difficult due to moonlight; very faint and quite diffuse with no clear central condensation","2455307.5000",""
"1878","P. Clay Sherrod","","c2005 L3 (McNaught)","04","21","2010","16.8(*)","13""","07/9","178-251","0.5m f/4.7 Dall Kirkham astrograph, CCD @ 2x2 binning","Morphology has changed significantly on this comet in past days; rather than a curving tail, it is appearing fanned shaped, extending from PA 178 to 251 deg, 21"" and 16"" length respectively; high concentrated nucleus (*m2=17.6)","2455307.5000",""
"1879","P. Clay Sherrod","","P/2010 H2 (Vales)","04","21","2010","12.6","69x53""","4/9","elong.","0.5m f/4.7 Dall Kirkham astrograph, CCD @ 2x2 binning","Comet is now exhibiting a more distinct nucleus if processed in high resolution (*m2=14.4); there is a ""shell"" perimeter at the NE quadrant of the elliptical coma; some extension suspected at PA 231 deg., possibly the beginning of tail structure","2455307.5000","Com1360847B.jpg"
"1880","P. Clay Sherrod","","81P Wild 2","04","21","2010","~8.5","233","6/9","298","0.5m f/4.7 Dall Kirkham astrograph, CCD, 2 x 2 binned","Tail is traced to about 10' in CCD frame; boomerang shape within SE coma continues, with the inner strong density coma measuring 69"" across surrounded by elliptical outer coma (*m2=12.3)","2455307.5000",""
"1881","P. Clay Sherrod","","P/2010 H2 (Vales)","05","05","2010","~13.2*","92""","5/9","159","0.5m f/4.7 Dall Kirkham astrography, CCD @ 2x2 binning","Some extension seen in PA 159, about 42"" length, or highly elongated in that direction; very distinct nuclear center now (*m2=15.7) with bright and uniform coma","2455321.5000",""
"1883","P. Clay Sherrod","","81P Wild 2","05","05","2010","11.9*","231""","5/9","289","0.5m f/4.7 Dall Kirkham astrograph, CCD at 2x2 binning","Comet appears virtually unchanged, but a bit brighter (m2=11.9*), tail vague in PA 289 for at least 10 min. arc length; solid nuclear center with no disentegration","2455321.5000",""
"1885","P. Clay Sherrod","","74P - Smirnova-Chernykh","05","08","2010","16.1 (*)","19""","8/9","295","0.5m f/4.7 Dall Kirkham astrograph, CCD binned 2x2","Comet is very condensed with strong nucleus (*m2=16.7) and very little diffuse coma; nice straight tail in PA 295d for 315""","2455324.5000",""
"1886","P. Clay Sherrod","","81P Wild 2","05","08","2010","~11 (*)","213""","5/9","295","0.5m f/4.7 Dall Kirkham astrograph, CCD binned 2x2","Tail unchanged, very vague, in PA 295 deg. some 11' length; larger nuclear center (*m2=12.4) with less evident coma","2455324.5000",""
