"recno","Observer","Location","Desg","Month","Day","Year","m1","diam","dc","pa","scope","comments","jd","url"
"621","P. Clay Sherrod","ASO - Conway","67P Churyumov-Gerasimenko","2","5.34","2003","15.8","17""","4/9","none","0.41m SCT/ccd....","Faint and nebulous open coma with small m2","2452675.8400",""
"622","P. Clay Sherrod","ASO - Conway","155P Shoemaker 3","2","5.31","2003","14.8","21""","6/9","n/a","0.41m SCT/ccd....","Comet appears visibly fainter but not smaller than previous; some concentration and perhaps irregularity to coma perimeter","2452675.8100",""
"625","P. Clay Sherrod","ASO - Conway","C/2002 T7 (LINEAR)","2","5.06","2003","15.9","12""","8/9","none","0.41m SCT/ccd....","Some diffusity to object, with tight concentration in small coma; brightness steady","2452675.5600",""
"626","P. Clay Sherrod","ASO - Conway","81P Wild 2","2","5.06","2003","15.8","15""","4/9","95","0.41m SCT/ccd....","Comet has faded significantly size last observation, not easy with fairly large veiled coma and extended perimeter centered at PA 95 deg.  Slight central conds.","2452675.5600",""
"627","P. Clay Sherrod","ASO - Conway","155P Shoemaker 3","2","8.27","2003","15.6","16""","6/9","","0.41m SCT/ccd....","Comet appears considerably fainter and more compact than previously, even under very good conditions; three measurements, all ~15.5 m1; no tail, strong condensation","2452678.7700",""
"629","P. Clay Sherrod","ASO - Conway","C/2001 B2 (NEAT)","2","8.44","2003","18.1","16""","2/9","none","0.41m SCT/ccd....","An incredibly interesting sight; the coma is like a transparent veil with no condensation whatsoever; extremely easy to miss, but similarly recorded on three astrometric images","2452678.9400",""
"630","P. Clay Sherrod","ASO - Conway","C/2002 T7 (LINEAR)","2","8.22","2003","16.0","13""","7/9","none","0.41m SCT/ccd....","Comet virtually unchanged; clearly nebulous around perimeter and possibly elongated slightly to E of center","2452678.7200",""
"631","P. Clay Sherrod","ASO - Conway","67P Churyumov-Gerasimenko","2","8.31","2003","15.8","22""","3/9","275?","0.41m SCT/ccd....","Coma is clearly elongated in a near E-W orientation, major axis meauring 22"" across; very little condensation.","2452678.8100",""
"633","P. Clay Sherrod","ASO - Conway","C/2002 X1 (LINEAR)","2","8.26","2003","15.9 (*)","16""","7/9","none","0.41m SCT/ccd....","Comet perhaps oval-shaped in NE-SW direction; very open and diffuse with near stellar (*m2=16.9ccd) nucleus","2452678.7600",""
"636","P. Clay Sherrod","ASO - Conway","C/2002 O7 (LINEAR)","2","8.45","2003","16.7","15""","3/9","none","0.41m SCT/ccd....","Comet is becoming an easy object, with no tail, round coma and very little central brightening","2452678.9500",""
"637","P. Clay Sherrod","ASO - Conway","C/2000 SV74 (LINEAR)","2","8.44","2003","14.7 (*)","12""","6/9","","0.41m SCT/ccd....","Comet is becoming an interesting and fairly easy target; strong central condensation (*m2=16.7ccd) embedded centrally in a very evenly distributed round coma","2452678.9400",""
"638","P. Clay Sherrod","ASO - Conway","C/2000 SV74 (LINEAR)","2","11.45","2003","15.4","14""","3/9","","0.41m SCT/ccd....","Very compact, with faint evenly-illuminated coma","2452681.9500",""
"639","P. Clay Sherrod","ASO - Conway","C/2001 G1 (LONEOS)","2","11.46","2003","15.7","11""","4/9","","0.41m SCT/ccd....","Compact with very little central conds.; becoming brighter","2452681.9600",""
"640","P. Clay Sherrod","ASO - Conway","53P Van Biesbroeck","2","11.48","2003","18.5","<12""","7/9","none","0.41m SCT/ccd....","Very tiny and difficult; near threshold; confirmed astrometrically in very deep skies","2452681.9800",""
"643","P. Clay Sherrod","ASO - Conway","67P Churyumov-Gerasimenko","2","11.42","2003","14.9","21"" irreg.","7/9","n/a","0.41m SCT/ccd....","An incredibly interesting sight, with the coma seemingly with a very irregular perimeter and even some streaming in random direction; not scatter nor noise; very condensed with stellar nucleus","2452681.9200",""
"644","P. Clay Sherrod","ASO - Conway","30P Reinmuth 1","2","11.41","2003","14.8","18""","6/9","n/a","0.41m SCT/ccd....","Maintaining status quo; very large and open with some degree of central brightening","2452681.9100",""
"645","P. Clay Sherrod","ASO - Conway","C/1999 U4 - Catalina-Skiff","2","11.37","2003","18.1","11""","8/9","none","0.41m SCT/ccd....","Tiny and quite difficult in star-poor region; confirmed astrometrically","2452681.8700",""
"647","P. Clay Sherrod","ASO - Conway","C/2002 X1 (LINEAR)","2","11.33","2003","16.6","12""","7/9","elong. ~95","0.41m SCT/ccd....","Some elongation to coma nearly due east, slightly south; very faint with some brightening in center","2452681.8300",""
"648","P. Clay Sherrod","ASO - Conway","C/2002 A3 (LINEAR)","2","11.33","2003","<19.7 stella","n/a","n/a","n/a","0.41m SCT/ccd....","Stellar threshold on three images to 19.8ccd; nothing seen at calculated position","2452681.8300",""
"650","P. Clay Sherrod","ASO - Conway","81P Wild 2","2","12.06","2003","15.4","16""","3/9","~90","0.41m SCT/ccd....","Some possible extension of an irregular coma in PA 90 deg; comet appears ""ragged"" along perimeter; strong moonlight nearby","2452682.5600",""
"652","P. Clay Sherrod","ASO - Conway","100P Hartley","2","12.46","2003","18.2","<10""","8/9","none","0.41m SCT/ccd....","Tiny with no nebulosity seen in very good dark skies; two astrometric confirmations","2452682.9600",""
"653","P. Clay Sherrod","ASO - Conway","C/2000 SV74 (LINEAR)","2","12.44","2003","15.8 (*)","14""","3/9","282","0.41m SCT/ccd....","Tail most definite in pa 282, short; *m2=16.8ccd.","2452682.9400",""
"655","P. Clay Sherrod","ASO - Conway","C/1999 U4 - Catalina-Skiff","2","12.41","2003","17.9","11""","3/9","none","0.41m SCT/ccd....","Comet is surprisingly large and very diffuse, making it a very difficult target, very open","2452682.9100",""
"656","P. Clay Sherrod","ASO - Conway","67P Churyumov-Gerasimenko","2","12.38","2003","15.6","12""","3/9","none","0.41m SCT/ccd....","Comet is small and faint, appears to be rapidly fading and/or getting smaller","2452682.8800",""
"657","P. Clay Sherrod","ASO - Conway","C/2002 X1 (LINEAR)","2","12.34","2003","16.9","12""","6/9","none","0.41m SCT/ccd....","Very faint and difficult with moonlight filling sky; comet does appear to exhibit elongated coma however in SE direction from astrometric center","2452682.8400",""
"658","P. Clay Sherrod","ASO - Conway","C/2000 SV74 (LINEAR)","2","13.45","2003","16.0","14""","3/9","none","0.41m SCT/ccd....","Comet is difficult and small in hazy moonlit skies","2452683.9500",""
"660","P. Clay Sherrod","ASO - Conway","67P Churyumov-Gerasimenko","2","13.40","2003","15.8","15""","4/9","none","0.41m SCT/ccd....","Comet is faint and small in moonlit and hazy skies","2452683.9000",""
"663","P. Clay Sherrod","ASO - Conway","C/2002 X1 (LINEAR)","2","13.34","2003","16.2","11""","7/9","n/a","0.41m SCT/ccd....","Comet appears brighter tonight in spite of close moonlight which may have affected m1 estimates.","2452683.8400",""
"664","P. Clay Sherrod","ASO - Conway","155P Shoemaker 3","2","13.39","2003","14.9","19"" moon","5/9","unknown","0.41m SCT/ccd....","Moonlight hampers accurate m1 and size estimates","2452683.8900",""
"665","P. Clay Sherrod","ASO - Conway","81P Wild 2","2","13.07","2003","15.0","15""","3/9","95?","0.41m SCT/ccd....","Possible due east elongation from coma; comet is very difficult in bright moonlit skies and high clouds","2452683.5700",""
"668","P. Clay Sherrod","ASO - Conway","81P Wild 2","2","18.07","2003","15.4 (*)","18""","4/9","none","0.41m SCT/ccd....","Comet is very difficult due to rising full moon in east; *m2=16.0ccd; coma is large, extended with some minor central condensation; uniformly round","2452688.5700",""
"669","P. Clay Sherrod","ASO - Conway","C/2002 X1 (LINEAR)","2","18.10","2003","16.2","15""","4/9","none","0.41m SCT/ccd....","Comet is round, quite faint and very close to near-full moon.","2452688.6000",""
"670","P. Clay Sherrod","ASO - Conway","155P Shoemaker 3","2","18.37","2003","~15.1 moon","14"" moon","6/9","n/a","0.41m SCT/ccd....","Very strong moonlight interferes; m2 = 16.5ccd and comet seems pretty much unchanged from previous (2-13) observation in spite of moonlight","2452688.8700",""
"671","P. Clay Sherrod","ASO - Conway","155P Shoemaker 3","2","24.32","2003","14.8","14""","5/9","none","0.41m SCT/ccd....","Very poor conditions but comet appears to have brightened slightly within past week; open with nebulosity, but distinct core","2452694.8200",""
"672","P. Clay Sherrod","ASO - Conway","155P Shoemaker 3","2","23.32","2003","14.8","14""","5/9","none","0.41m SCT/ccd....","Very poor conditions but comet appears to have brightened slightly within past week; open with nebulosity, but distinct core","2452693.8200",""
"673","P. Clay Sherrod","ASO - Conway","67P Churyumov-Gerasimenko","2","23.31","2003","15.4","22""","3/9","none","0.41m SCT/ccd....","Noted in very poor conditions, but comet is very large, round and diffuse","2452693.8100",""
"675","P. Clay Sherrod","ASO - Conway","C/2002 X1 (LINEAR)","2","23.26","2003","16.5","14""","7/9","none","0.41m SCT/ccd....","Oval shape, some nebulosity but otherwise small and becoming quite difficult","2452693.7600",""
"677","P. Clay Sherrod","ASO - Conway","67P Churyumov-Gerasimenko","2","24.41","2003","15.6","14""","7/9","none","0.41m SCT/ccd....","Very highly condensed with nearly stellar nucleus of about mag. 16.1 ccd; otherwise small and quite regularly round","2452694.9100",""
"678","P. Clay Sherrod","ASO - Conway","155P Shoemaker 3","2","24.39","2003","15.8","16""","4/9","none","0.41m SCT/ccd....","Fairly faint and observed with intermittent clouds; uniformlyl nebulous and even perimeter","2452694.8900",""
"679","P. Clay Sherrod","ASO - Conway","53P Van Biesbroeck","2","24.44","2003","15.6","12""","4/9","none","0.41m SCT/ccd....","Quite condensed and very small and compact","2452694.9400",""
"682","P. Clay Sherrod","ASO - Conway","67P Churyumov-Gerasimenko","3","3.32","2003","15.2 (*)!","24""","3/9","none","0.41m SCT/ccd....","Very unusual irregular coma; large, with starlike central condensation (*m2=17.1ccd); the coma is spread over such a large area that m1 is difficult; perimeter of coma appears very uneven and irregular","2452701.8200",""
"684","P. Clay Sherrod","ASO - Conway","81P Wild 2","3","3.07","2003","15.5","17""","5/9","none","0.41m SCT/ccd....","Fairly large and evenly-bright coma with moderate central conds.","2452701.5700",""
"687","P. Clay Sherrod","ASO - Conway","53P Van Biesbroeck","3","3.44","2003","15.7","17""","4/9","none","0.41m SCT/ccd....","Round and fairly concentrated with uniform brightness","2452701.9400",""
"690","P. Clay Sherrod","ASO - Conway","C/2000 SV74 (LINEAR)","3","3.38","2003","15.8","16""","5/9","possible 260","0.41m SCT/ccd....","Unchanged, with slight indication of possible thin tail at PA 260 deg; some condensation toward center of coma","2452701.8800",""
"692","P. Clay Sherrod","ASO - Petit Jean Mountain","C/2002 X1 (LINEAR)","3","4.06","2003","16.4","10""","7/9","none","0.41m SCT/ccd....","Comet appears as a very small diffuse object and is quite difficult due to its small size; some condensation noted and comet is quite off from Observable Comets calculated","2452702.5600",""
"693","P. Clay Sherrod","ASO - Petit Jean Mountain","81P Wild 2","3","4.06","2003","15.3","20""","4/9","none","0.41m SCT/ccd....","Comet presents a very open and largely diffuse coma with little central condensation; hazy skies","2452702.5600",""
"694","P. Clay Sherrod","ASO - Petit Jean Mountain","155P Shoemaker 3","3","4.32","2003","15.3","18""","5/9","none","0.41m SCT/ccd....","Estimates made in high haze and poor conditions","2452702.8200",""
"695","P. Clay Sherrod","ASO - Petit Jean Mountain","C/1999 U4 - Catalina-Skiff","3","4.41","2003","17.8","11""","8/9","none","0.41m SCT/ccd....","Very little nebulosity; nearly stellar; Estimates made in high haze and poor conditions","2452702.9100",""
"697","P. Clay Sherrod","ASO - Petit Jean Mountain","67P Churyumov-Gerasimenko","3","4.33","2003","15.6 (m2)","n/a","3/9","n/a","0.41m SCT/ccd....","Estimates made in high haze and poor conditions; comet is very difficult due to large and diffuse coma; m2 possible only","2452702.8300",""
"698","P. Clay Sherrod","ASO - Petit Jean Mountain","C/2000 SV74 (LINEAR)","3","4.42","2003","15.7","18""","7/9","none","0.41m SCT/ccd....","Estimates made in high haze and poor conditions; coma is compact and uniform with nearly stellar center","2452702.9200",""
"702","P. Clay Sherrod","ASO - Conway H43","C/1999 U4 - Catalina-Skiff","3","6.44","2003","17.8","9""","7/9","none","0.41m SCT/ccd....","Very faint, starlike; confirmed astrometrically; no nebulosity","2452704.9400",""
"703","P. Clay Sherrod","ASO - Conway H43","C/2000 SV74 (LINEAR)","3","6.47","2003","15.9 (*)","16""","7/0","ext. 270","0.41m SCT/ccd....","Coma is elongated in PA 270 degree slightly; very nice and distinct nucleus (*m2=17.0ccd)","2452704.9700",""
"705","P. Clay Sherrod","ASO - Conway H43","C/2002 U2 (LINEAR)","3","6.47","2003","17.9","9""","8/9","none","0.41m SCT/ccd....","Appears quite stellar with no nebulosity; confirmed astrometrically","2452704.9700",""
"707","P. Clay Sherrod","ASO - Conway H43","C/2002 O7 (LINEAR)","3","6.45","2003","16.2","13""","7/9","none","0.41m SCT/ccd....","Quite difficult, in appulse with faint star; highly condensed","2452704.9500",""
"708","P. Clay Sherrod","ASO - Conway H43","C/2002 O7 (LINEAR)","3","7.42","2003","16.4","18""","4/9","none","0.41m SCT/ccd....","Comet is fairly large to be so faint, with ""halo"" coma extending over very vague central condensation","2452705.9200",""
"709","P. Clay Sherrod","ASO - Conway H43","46P Wirtanen","3","7.41","2003","18.6","12""","3/9","none","0.41m SCT/ccd....","Very open and diffuse with no sign of central brightening; extremely difficult due to extended nature","2452705.9100",""
"710","P. Clay Sherrod","ASO - Conway H43","C/2002 U2 (LINEAR)","3","7.47","2003","17.6","10""","7/9","none","0.41m SCT/ccd....","Ver faint, difficult, nearly stellar","2452705.9700",""
"712","P. Clay Sherrod","ASO - Conway H43","C/2000 SV74 (LINEAR)","3","7.37","2003","15.4","20""","4/9","none","0.41m SCT/ccd....","Round and quite an easy target; fairly large and open","2452705.8700",""
"715","P. Clay Sherrod","ASO - Conway H43","155P Shoemaker 3","3","7.29","2003","15.6","18""","7/9","none","0.41m SCT/ccd....","Comet seems to be fading fairly rapidly and is not an easy target due to low surface brightness; however there is a clear stellar-like nucleus of about 17.2 mag.","2452705.7900",""
"716","P. Clay Sherrod","ASO - Conway H43","C/2002 X1 (LINEAR)","3","7.08","2003","16.8","15""","7/9","elong. E-W","0.41m SCT/ccd....","Coma is concentrated but extended and appears elongated in a true E-W orientation","2452705.5800",""
"717","P. Clay Sherrod","ASO - Conway H43","C/2002 T7 (LINEAR)","3","7.07","2003","15.5","16""","6/9","none","0.41m SCT/ccd....","The brightness of this comet was a pleasant surprise from previous observations, with a very conspicuous and compactly bright coma, equally bright across with no evidence of m2 seen","2452705.5700",""
"719","P. Clay Sherrod","ASO - Conway H43","81P Wild 2","3","7.05","2003","15.7","18""","3/9","none","0.41m SCT/ccd....","Fairly large and conspicuous; pretty much evenly diffuse across coma with little or no central condensation","2452705.5500",""
"720","P. Clay Sherrod","ASO - Conway H43","67P Churyumov-Gerasimenko","3","8.35","2003","15.7 (*)","0.28","3/9","segmented co","0.41m SCT/ccd....","Remarkable coma on this comet; the head appears to be segmented or having a darkened lane running SE to NW; the perimeter of the comet is highly irregular and with considerable ""texture;"" *m2=16.9ccd, very stellar","2452706.8500",""
"722","P. Clay Sherrod","ASO - Conway H43","C/2000 SV74 (LINEAR)","3","8.40","2003","15.8","18"" (fog)","4/9","none","0.41m SCT/ccd....","Very large and open with little central conds.; very poor conditions likely affecting visibility of total extent of coma","2452706.9000",""
"724","P. Clay Sherrod","ASO - Conway H43","155P Shoemaker 3","3","8.34","2003","15.9","16""","7/9","","0.41m SCT/ccd....","Comet appears virtually unchanged with strong central condensation","2452706.8400",""
"725","P. Clay Sherrod","ASO - Conway H43","C/2002 X1 (LINEAR)","3","9.09","2003","15.9","14""","4/9","none","0.41m SCT/ccd....","Quite open and diffuse; a difficult object due to low surface brightness","2452707.5900",""
"727","P. Clay Sherrod","ASO - Conway H43","81P Wild 2","3","9.07","2003","15.9","19""","4/9","none","0.41m SCT/ccd....","Poor conditions with high clouds and moon; comet is large, diffuse and round; little central condensation","2452707.5700",""
"728","P. Clay Sherrod","ASO - Conway H43","155P Shoemaker 3","3","9.32","2003","16.3","14""","6/9","none","0.41m SCT/ccd....","Quite small and vague; becoming a very difficult object","2452707.8200",""
"729","P. Clay Sherrod","ASO - Conway H43","C/2000 SV74 (LINEAR)","3","9.39","2003","16.0","16""","4/9","none","0.41m SCT/ccd....","Nebulous and featureless coma, elonged slightly E-W","2452707.8900",""
"731","P. Clay Sherrod","ASO - Conway H43","C/2002 U2 (LINEAR)","3","9.43","2003","17.4","12""","7/9","none","0.41m SCT/ccd....","Very small and nearly stellar, no nebulosity; confirmed astrometrically","2452707.9300",""
"732","P. Clay Sherrod","ASO - Conway H43","C/1999 U4 - Catalina-Skiff","3","9.41","2003","17.8","17""","3/9","none","0.41m SCT/ccd....","Comet is very difficult because of low surface brightness and large circular area of coma; very little central brightening","2452707.9100",""
"735","P. Clay Sherrod","ASO - Conway H43","53P Van Biesbroeck","3","10.42","2003","16.6","13""","4/9","none","0.41m SCT/ccd....","Very faint, small diffuse circular patch with slight central conds.","2452708.9200",""
"736","P. Clay Sherrod","ASO - Conway H43","C/2002 O7 (LINEAR)","3","10.40","2003","16.0","14""","6/9","none","0.41m SCT/ccd....","Fairly well condensed with rather large coma to be this dim; coma circular and nucleus is centered within","2452708.9000",""
"737","P. Clay Sherrod","ASO - Conway H43","C/1999 U4 - Catalina-Skiff","3","10.34","2003","17.7","13""","4/9","none","0.41m SCT/ccd....","Very small and quite difficult with low surface brightness; definitely diffuse","2452708.8400",""
"738","P. Clay Sherrod","ASO - Conway H43","C/2002 U2 (LINEAR)","3","10.41","2003","17.7","12""","7/9","none","0.41m SCT/ccd....","Very difficult in moist skies and high wind; very stellar and confirmed via astrometric span","2452708.9100",""
"739","P. Clay Sherrod","ASO - Conway H43","C/2000 SV74 (LINEAR)","3","10.39","2003","15.9","20""","4/9","none","0.41m SCT/ccd....","Comet is very large and diffuse for its brightness; very little condensation and seemingly symmetrical across coma","2452708.8900",""
"743","P. Clay Sherrod","ASO - Conway H43","67P Churyumov-Gerasimenko","3","10.32","2003","16.1","28""","2/9","irreg.","0.41m SCT/ccd....","Comets seems to be expanding, large irregular coma, no tail; no sign of even a faint nucleus on this night; perimeter of coma is very uneven","2452708.8200",""
"744","P. Clay Sherrod","ASO - Conway H43","155P Shoemaker 3","3","10.42","2003","16.6","14""","3/9","none","0.41m SCT/ccd....","This comet is fading in both brightness and size rapidly; not an easy object, with very low surface brightness and little condensation; round","2452708.9200",""
"745","P. Clay Sherrod","ASO - Conway H43","C/2000 SV74 (LINEAR)","3","11.43","2003","15.8","12""","4/9","none","0.41m SCT/ccd....","Comet is obviously nebulous with no central condensation; not a particularly easy target","2452709.9300",""
"746","P. Clay Sherrod","ASO - Conway H43","155P Shoemaker 3","3","11.31","2003","16.6","19""","2/9","none","0.41m SCT/ccd....","Very large and open; no central condensation, making this a very tough target; fair conditions","2452709.8100",""
"747","P. Clay Sherrod","ASO - Conway H43","C/2002 U2 (LINEAR)","3","11.41","2003","17.0","<12""","8/9","none","0.41m SCT/ccd....","Stellar in appearance, no nebulosity but skies are now a bit hazy; confirmed astrometrically","2452709.9100",""
"749","P. Clay Sherrod","ASO - Conway H43","53P Van Biesbroeck","3","11.44","2003","16.5","17""","4/9","none","0.41m SCT/ccd....","Very easy target despite its low magnitude; come is round and clearly diffuse in star-poor field","2452709.9400",""
"754","P. Clay Sherrod","ASO - Conway H43","C/2001 G1 (LONEOS)","3","12.38","2003","17.0","11""","8/9","none","0.41m SCT/ccd....","Appears stellar, no nebulosity; confirmed astrometrically","2452710.8800",""
"756","P. Clay Sherrod","ASO-Petit Jean","C/2002 T7 (LINEAR)","3","22.08","2003","15.2","17""","7/9","none","...0.41m SCT/ccd.......P. Clay Sherrod, (ASO - Petit Jean Mountain,  H43","Comet has not been seen in two weeks in lieu of clouds; remarkably brighter tonight, compact and very concentrated","2452720.5800",""
"757","P. Clay Sherrod","ASO-Petit Jean","155P Shoemaker 3","3","22.10","2003","16.9","12""","4/9","none","...0.41m SCT/ccd.......P. Clay Sherrod, (ASO - Petit Jean Mountain,  H43","Very diffuse and faint; near threshold and very small","2452720.6000",""
"758","P. Clay Sherrod","ASO-Petit Jean","30P Reinmuth 1","3","22.12","2003","14.4","28""","7/9","none","...0.41m SCT/ccd.......P. Clay Sherrod, (ASO - Petit Jean Mountain,  H41)","Very unusual comet, with large halo-type coma and very distinct stellar nucleus of about mag. 17.2; coma is evenly distributed in brightness and perfectly circular","2452720.6200",""
"759","P. Clay Sherrod","ASO - Conway H43","155P Shoemaker 3","3","24.14","2003","16.9","14""","3/9","none","0.41m SCT/ccd....","Comet has faded significantly during past two weeks; very vague and open; quite difficult with very little central condensation","2452722.6400",""
"760","P. Clay Sherrod","ASO - Conway H43","C/2002 X1 (LINEAR)","3","24.13","2003","16.7","12""","7/9","none","0.41m SCT/ccd....","Very small and starlike; confirmed astrometrically; a very difficult object due to low brightness and size, with perhaps some bit of nebulosity","2452722.6300",""
"765","P. Clay Sherrod","ASO - Conway H43","C/2000 SV74 (LINEAR)","3","24.34","2003","15.4","20""","3/9","none","0.41m SCT/ccd....","Circular coma like halo with embedded central nucleus, nearly stellar","2452722.8400",""
"768","P. Clay Sherrod","ASO - Conway H43","C/2001 RX14","3","25.35","2003","10.7 (*)","0.25 haze","7/9","fanned","0.41m SCT/ccd....","Large and broad tail obscured by high haze; poor conditions; *m2 = 14.5ccd","2452723.8500",""
"769","P. Clay Sherrod","ASO - Conway H43","30P Reinmuth 1","3","25.34","2003","14.5","18""","7/9","none","0.41m SCT/ccd....","Very nice central condensation, about 16th mag., with halo-like and very thin coma surrounding","2452723.8400",""
"770","P. Clay Sherrod","ASO - Conway H43","C/2000 SV74 (LINEAR)","3","25.36","2003","15.8","22""","3/9","none","0.41m SCT/ccd....","Very large and open, little central brightening, coma seems fairly uniform; high haze and incoming clouds","2452723.8600",""
"771","P. Clay Sherrod","ASO - Conway H43","155P Shoemaker 3","3","25.32","2003","17.4","14""","4/9","none","0.41m SCT/ccd....","Comet is becoming very faint and difficult; seems to be rapidly fading in past weeks; nearly stellar but appears somewhat diffuse on images","2452723.8200",""
"772","P. Clay Sherrod","ASO - Conway H43","155P Shoemaker 3","3","27.26","2003","17.2","10""","3/9","n/a","0.41m SCT/ccd....","Comet has become very difficult, small; diffuse and definitely not stellar in appearance","2452725.7600",""
"774","P. Clay Sherrod","ASO - Conway H43","C/2000 SV74 (LINEAR)","3","27.32","2003","15.7","22""","4/9","210 ?","0.41m SCT/ccd....","Possible very faint tail imaged in PA 210 deg; very easy target with uniformly bright coma","2452725.8200",""
"778","P. Clay Sherrod","ASO - Conway H43","C/2001 G1 (LONEOS)","3","27.37","2003","17.9","<12""","3/9","none","0.41m SCT/ccd....","Very small and vague/diffuse object; confirmed astrometrically; no notable structure but not particularly stellar","2452725.8700",""
"779","P. Clay Sherrod","ASO - Conway H43","53P Van Biesbroeck","3","27.39","2003","15.6","18""","6/9","272","0.41m SCT/ccd....","Showing a very short and broad tail in PA 272; comet is small with distinct central condensation","2452725.8900",""
"780","P. Clay Sherrod","ASO - Conway H43","C/2003 F1 (LINEAR)","3","27.44","2003","17.5","14""","6/9","none","0.41m SCT/ccd....","Comet appears very stellar with little or no nebulosity","2452725.9400",""
"781","P. Clay Sherrod","ASO - Conway H43","C/2002 O7 (LINEAR)","3","27.40","2003","15.1","19"" irreg.","4/9","270 fan","0.41m SCT/ccd....","Comets shows a very stubby fanned area due west from coma (PA 270 deg.); some central brightening","2452725.9000",""
"783","P. Clay Sherrod","ASO - Conway H43","C/2002 X1 (LINEAR)","3","31.09","2003","17.2","8""","8/9","none","0.41m SCT/ccd....","Stellar with possible sligyht E-W elongation; confirmed astrometrically; very difficult","2452729.5900",""
"785","P. Clay Sherrod","ASO - Conway H43","53P Van Biesbroeck","3","31.40","2003","16.0","18""","4/9","none","0.41m SCT/ccd....","Quite round with concentrated brightness; fairly easy target, clearly diffuse","2452729.9000",""
"788","P. Clay Sherrod","ASO - Conway H43","C/2003 F1 (LINEAR)","4","1.43","2003","17.2","12""","5/9","none","0.41m SCT/ccd....","Very distinct stellar object with little or no nebulosity; position is far W of computed Harvard list; confimed via 5 astrometric measurements","2452730.9300",""
"790","P. Clay Sherrod","ASO - Petit Jean","46P Wirtanen","4","11.36","2003","18.6","14""","2/9","none","0.41m SCT/ccd....","Very vague open, with no strong condensation; very difficult in spite of near-perfect skies.","2452740.8600",""
